{
  "$schema": "../execution.schema.json",
  "schemaVersion": 1,
  "operationId": "20260905080144-reply-posted-2026-09-05-linkedin-reply-praveen-email-operating-inputs",
  "action": "reply_posted",
  "recordedAt": "2026-09-05T08:01:44Z",
  "executionSurface": "user_initiated_signed_in_linkedin_ui",
  "initiatedBy": "user",
  "githubIssueNumber": 36,
  "userConfirmation": {
    "obtained": true,
    "confirmedAt": "2026-09-05T08:01:44Z",
    "scope": "User approved N1, N2, N3 and N4 exactly as written on 2026-09-05."
  },
  "result": {
    "status": "reply_posted",
    "candidateId": "2026-09-05-linkedin-reply-praveen-email-operating-inputs",
    "targetUrl": "https://www.linkedin.com/feed/?highlightedUpdateUrn=urn%3Ali%3Aactivity%3A7501677792317558784&highlightedUpdateType=REPLIED_TO_YOUR_COMMENT&origin=inapp&showCommentBox=true",
    "publicUrl": "https://www.linkedin.com/feed/?highlightedUpdateUrn=urn%3Ali%3Aactivity%3A7501677792317558784&highlightedUpdateType=REPLIED_TO_YOUR_COMMENT&origin=inapp&showCommentBox=true",
    "publishedTextSha256": "e4d5b205d50c9220f5cadfca1839424816cf92f6fe0f1582f9e91c56b2314df6",
    "verifiedAt": "2026-09-05T08:01:44Z",
    "verification": "LinkedIn rendered the exact approved reply under Aditya Singh with a current timestamp and a clickable Praveen Shahi mention in the intended nested thread."
  },
  "secretsStored": false,
  "githubActionsPerformedLinkedInAction": false
}
