{
  "$schema": "../execution.schema.json",
  "schemaVersion": 1,
  "operationId": "20260904101358-reply-posted-2026-09-04-linkedin-reply-peter-planted-exception-recall",
  "action": "reply_posted",
  "recordedAt": "2026-09-04T10:13:58Z",
  "executionSurface": "user_initiated_signed_in_linkedin_ui",
  "initiatedBy": "user",
  "githubIssueNumber": 36,
  "userConfirmation": {
    "obtained": true,
    "confirmedAt": "2026-09-04T10:13:58Z",
    "scope": "User approved the Shabina reply and connection acceptance, and the Peter reply exactly as written on 2026-09-04."
  },
  "result": {
    "status": "reply_posted",
    "candidateId": "2026-09-04-linkedin-reply-peter-planted-exception-recall",
    "targetUrl": "https://www.linkedin.com/feed/?highlightedUpdateUrn=urn:li:activity:7501562942031781889&highlightedUpdateType=REPLIED_TO_YOUR_COMMENT&origin=inapp&showCommentBox=true&commentUrn=urn:li:comment:7501561433529384961&replyUrn=7501562935622664192&dashCommentUrn=urn:li:fsd_comment:(7501561433529384961,urn:li:activity:7501243855439257600)&dashReplyUrn=urn:li:fsd_comment:(7501562935622664192,urn:li:activity:7501243855439257600)",
    "publicUrl": "https://www.linkedin.com/feed/?highlightedUpdateUrn=urn:li:activity:7501562942031781889&highlightedUpdateType=REPLIED_TO_YOUR_COMMENT&origin=inapp&showCommentBox=true&commentUrn=urn:li:comment:7501561433529384961&replyUrn=7501562935622664192&dashCommentUrn=urn:li:fsd_comment:(7501561433529384961,urn:li:activity:7501243855439257600)&dashReplyUrn=urn:li:fsd_comment:(7501562935622664192,urn:li:activity:7501243855439257600)",
    "publishedTextSha256": "9d8c4942fbd872a0084d7cb3b5fa0de43c30b577185fea88dfa87ede01faf4c9",
    "verifiedAt": "2026-09-04T10:13:58Z",
    "verification": "LinkedIn rendered the exact approved reply under Aditya Singh with a current timestamp and a clickable Peter Cheyne mention in the nested reply thread."
  },
  "secretsStored": false,
  "githubActionsPerformedLinkedInAction": false
}
