{
  "$schema": "../execution.schema.json",
  "schemaVersion": 1,
  "operationId": "20260828074106-reply-posted-2026-08-28-linkedin-reply-sara-series-part2",
  "action": "reply_posted",
  "recordedAt": "2026-08-28T07:41:06Z",
  "executionSurface": "user_initiated_signed_in_linkedin_ui",
  "initiatedBy": "user",
  "githubIssueNumber": 36,
  "userConfirmation": {
    "obtained": true,
    "confirmedAt": "2026-08-28T07:41:06Z",
    "scope": "Approve all three exactly as written"
  },
  "result": {
    "status": "reply_posted",
    "candidateId": "2026-08-28-linkedin-reply-sara-series-part2",
    "targetUrl": "https://www.linkedin.com/feed/update/urn:li:activity:7498941183755333632/",
    "publicUrl": "https://www.linkedin.com/feed/update/urn:li:activity:7498941183755333632/",
    "publishedTextSha256": "3bb8d95db1692a1bffd9afe765c80d7171e6225cd9f78452139b8c90d04e9a6e",
    "verifiedAt": "2026-08-28T07:41:06Z",
    "verification": "LinkedIn rendered the exact approved threaded reply under Aditya Singh and the intended Sara Simeone mention as a clickable profile link; the reply is visible beneath Sara’s comment"
  },
  "secretsStored": false,
  "githubActionsPerformedLinkedInAction": false
}
